ticker,report_date,Company Overview_name,Company Overview_sector,Company Overview_industry,Company Overview_market_cap,Company Overview_insight,Company Overview_signal,Financial Performance_revenue,Financial Performance_net_income,Financial Performance_operating_cash_flow,Financial Performance_capital_expenditures,Financial Performance_trailing_pe_ratio,Financial Performance_forward_pe_ratio,Financial Performance_price_to_book,Financial Performance_price_to_sales_ratio,Financial Performance_dividend_rate,Financial Performance_dividend_yield,Financial Performance_payout_ratio,Financial Performance_earnings_growth,Financial Performance_revenue_growth,Financial Performance_profit_margins,Financial Performance_return_on_assets,Financial Performance_return_on_equity,Financial Performance_gross_margins,Financial Performance_ebitda_margins,Financial Performance_current_ratio,Financial Performance_quick_ratio,Financial Performance_debt_to_equity,Financial Performance_free_cash_flow,Financial Performance_insight,Financial Performance_signal,Market Performance_current_price,Market Performance_average_price,Market Performance_price_change,Market Performance_high_low_spread,Market Performance_volatility,Market Performance_average_volume,Market Performance_max_volume,Market Performance_52_week_high,Market Performance_52_week_low,Market Performance_beta,Market Performance_insight,Market Performance_signal,Analyst Recommendations_target_high_price,Analyst Recommendations_target_low_price,Analyst Recommendations_recommendation_mean,Analyst Recommendations_strong_buy,Analyst Recommendations_buy,Analyst Recommendations_hold,Analyst Recommendations_sell,Analyst Recommendations_strong_sell,Analyst Recommendations_insight,Analyst Recommendations_signal,Recent News_insight,Recent News_signal
MSFT,2025-01-17,Microsoft Corporation,Technology,Software - Infrastructure,3156701347840,"Microsoft Corporation, a leading entity in the Technology sector within the Software - Infrastructure industry, boasts a substantial market capitalization of approximately $3.16 trillion, indicating its significant influence and robust financial standing. The company's diverse portfolio, including cloud computing through Azure, productivity suites with Microsoft Office 365, and hardware segments such as Surface devices, positions it well to capitalize on digital transformation trends and remote work initiatives. The consistent growth in its Azure platform underscores a shift toward hybrid cloud solutions, which is expected to remain a critical driver for revenue expansion.

Opportunities are abundant given the company's strategic investments in AI, gaming through Xbox, and acquisitions aimed at bolstering its cloud infrastructure and security services. However, potential risks include intensified competition from rivals like Amazon Web Services (AWS) and Google Cloud, regulatory challenges in international markets, and cybersecurity threats that could impact customer trust. Additionally, dependency on certain enterprise clients poses a risk of revenue fluctuation.

In conclusion, Microsoft's strong financial health, strategic growth initiatives, and dominant position in the cloud market make it an attractive investment opportunity. The company is expected to continue benefiting from ongoing digital transformation trends and innovation. Despite notable risks such as competition and regulatory scrutiny, its track record and diversified portfolio offer substantial upside potential.",1,"$65,585,000,000.00","$24,667,000,000.00","$34,180,000,000.00","$-14,923,000,000.00",35.089252,28.281464,10.973043,12.418669,3.32,0.0078,0.2477,0.104,0.16,0.35608003,0.14592,0.35604,0.69348997,0.53720003,1.301,1.163,33.657,61280874496,"The company exhibits strong financial performance with significant revenue and net income growth of 16% and a healthy earnings growth rate of 10.4%. The operating cash flow is robust at $34.18 billion, exceeding capital expenditures by a wide margin ($14.92 billion), yielding substantial free cash flow of approximately $61.3 billion. High profit margins (35.6%) and exceptional return on equity (35.6%) suggest efficient operational management and solid shareholder value creation. Despite this, the trailing P/E ratio is relatively high at 35.09, indicating elevated expectations from the market which are somewhat tempered by a lower forward P/E of 28.28 reflecting anticipated growth.

Valuation metrics like the price-to-sales ratio (12.42) and low dividend yield (0.78%) could be seen as modest when compared to high profit margins, suggesting potential undervaluation relative to earnings quality. However, gross margins are solid at approximately 69.3%, indicating pricing power or cost control effectiveness.

Risks lie within the high debt-to-equity ratio of 33.657, which may signal excessive leverage and financial vulnerability if economic conditions worsen. Furthermore, low current (1.301) and quick ratios indicate potential liquidity challenges. The dividend payout ratio is moderate at 24.77%, suggesting a balance between rewarding shareholders and reinvesting earnings for growth.

Overall, the growth indicators and strong operational performance present opportunities. Nonetheless, financial leverage and liquidity pose risks that warrant caution.",1,424,425,1.19%,12.08%,12.14%,21023362,64263700,468.35,385.58,0.904,"The current price of the stock is slightly below its average price at $424 compared to an average of $425, indicating modest downward pressure recently. The 1.19% increase suggests potential recovery from a recent dip as it's moving within a high-low spread of 12.08%. A volatility rate of 12.14% shows moderate risk and reward balance, aligning with its beta of 0.904, which signals slightly less market sensitivity than average. The current trading volume is below the maximum, indicating lower investor participation in recent transactions relative to past levels. Despite these factors, the stock's price remains well above its 52-week low at $385.58 and has significant room for growth towards its 52-week high of $468.35. Potential risks include market volatility and any potential external shocks affecting the broader market or sector-specific conditions. However, opportunities may arise from economic recovery phases or company-specific positive developments driving upward momentum.

**Recommendation:** This stock might be attractive to investors considering a mid-to-long-term horizon due to its recent rebound and room for growth towards its 52-week peak. Given these factors and the moderate risk profile, it suggests potential stability with upside movement.",1,650.0,420.0,1.41379,14,38,5,0,0,"The analyst recommendations data indicates a positive outlook for the equity, with a mean recommendation value of 1.41379, suggesting an overall tendency towards buy actions (strong buy and buy combined). The absence of sell or strong sell ratings highlights strong confidence among analysts about the company's prospects, without significant perceived downside risk at this time. Targets are optimistically set between 420.0 to 650.0 indicating potential for price appreciation. However, investors should be aware of external factors like market volatility and industry-specific risks that could impact performance.",1,"Microsoft (MSFT) retains a strong position in the market as indicated by Cantor Fitzgerald's upgrade to Overweight with a price target of $509. Despite concerns noted in analyses suggesting that Microsoft, alongside Tesla, could be viewed as underperformers, this rating suggests confidence from analysts about its future performance relative to competitors like NVDA, GOOG, AAPL, and TSLA. The broader context involves increasing focus on generative AI growth strategies within major tech companies, such as Dataiku's success noted by Simply Wall St., which can indirectly benefit cloud giants like Microsoft and Google (GOOG). However, there are risks reflected in related stocks such as Fastenal (FAST), which missed its sales targets impacting stock prices negatively. Thus, while market sentiment is cautiously optimistic for tech leaders investing in AI and cloud innovations, diversification and specific sector analysis remain crucial due to potential volatility stemming from individual firm performances and broader economic conditions.",1
